{
  "statementID": "3ff64336-9d26-49da-b0ce-f4685c6af139",
  "statementType": "entityStatement",
  "entityType": "registeredEntity",
  "isComponent": false,
  "name": "REN Consulting Limited",
  "identifiers": [
    {
      "scheme": "XE-KS-SRC",
      "id": "93821344"
    }
  ],
  "publicationDetails": {
    "publicationDate": "2017-12-01",
    "bodsVersion": "0.2",
    "publisher": {
      "name": "XXXXXXXXX"
    }
  }
}
