{
  "statementID": "323591c5-2093-4716-8494-c5573c7452e6",
  "statementType": "entityStatement",
  "isComponent": false,
  "statementDate": "2018-11-14",
  "entityType": "registeredEntity",
  "name": "OPEN DATA SERVICES CO-OPERATIVE LIMITED",
  "foundingDate": "2015-04-24",
  "identifiers": [
    {
      "scheme": "GB-COH",
      "id": "09506232"
    }
  ],
  "incorporatedInJurisdiction": {
    "code": "GB"
  },
  "source": {
    "type": ["officialRegister"],
    "description": "Companies House, United Kingdom",
    "url": "https://beta.companieshouse.gov.uk/company/09506232",
    "assertedBy": [
      {
      "name": "OPEN DATA SERVICES CO-OPERATIVE LIMITED"
      }
    ],
    "retrievedAt": "2018-11-14T17:23:43.977Z"
  },
  "publicationDetails": {
    "publicationDate": "2019-01-05",
    "bodsVersion": "0.2",
    "publisher": {
      "url": "http://example.com/"
    }
  }
}
