{
  "statementID": "155009d4-9295-4845-9079-b6b69a17e185",
  "statementType": "entityStatement",
  "entityType": "registeredEntity",
  "isComponent": false,
  "name": "RENCO Energy Ltd",
  "identifiers": [
    {
      "scheme": "XE-DI-CR",
      "id": "56462342"
    }
  ],
  "publicationDetails": {
    "publicationDate": "2017-12-01",
    "bodsVersion": "0.2",
    "publisher": {
      "name": "XXXXXXXXX"
    }
  }
}
